подходит полностью во всем.,Удобно менять и натягивать цепь(в отличии от партнера и хуксварны)Оригинальные крышки топливного и масляного бака.Моторесурс.,"Качество сборки, вес, мощность, производительность!",настоящее немецкое качество,"В работе почти каждый день, только плюсы.","способна на длительную работу, надежная антивибрационная система, удобная пила."," отличная пила, качественной сборки, пилит без усилий.",Довольно мощная пила.," пилит быстро и без усилий, мощная, хорошая система антивибрации. ", удобная в эксплуатации пила.,способна выполнять любые объемы работ.,"Легкая, мощная. Заводится с полоборота, адекватная цена.","Отличный аппарат, пилит отлично, опыт использования небольшой, так что пока все хорошо.","Пилит и пилит...:) покупал 6 лет назад за 11000. хотел купить MS180, но купил эту и не пожалел... запас мощности при не очень острой(тупой) цепи ой как важен!:))) легко пилит древесину до 25 см в диаметре при условии что стоит живая цепь. с тупой и сколотой цепью тоже что удивительно пилит, благо мощности хватает, но уже не ходом не как горячий нож по маслу... Пилит сухую лиственницу топляк с тупой цепью, искры летят дым валит, но ведь пилит! ничего не ломалось... цепи, масло и бензин... цепи только родные покупаю всегда...Качество сборки на высоте, немецкая сборка... хороший крепкий пластик, прощает небрежное обращение, удары и падения с высоты... заводится в любой мороз, пилил даже в -43... летом в жару пилил часами, не перегревается...","легкая, мощная, удобная, малый вес, наличие специализированного сервиса с любыми зч, шина 40см","Сегодня стал обладателем данной пилы сразу решил обкатать,  не напрягая пилу  с передышками перепилил  около 3 кубов  березняка. Что могу сказать пила новая компрессия зверская,  заводится с одного двух рывков.  хорошо реагирует на газ, при распилке дерева большего диаметра обороты не падают   бензина хватает на долго.  Легко найти расходники, (цепи, полотна, звездочки)","Очень мощная, крепкая","мощная и надежная бензопила, отличное решение для строительства из дерева.","Раньше была хорошая надёжная пила, но увы...","ЛЕГКАЯ, МОЩНАЯ, НАДЕЖНАЯ!","легкая, мощная, полупрофессиональная бензиновая пила ","УДОБНАЯ, ЛЁГКАЯ, МОЩНАЯ","STIHL!!!!!! Made In Germani!!! Отличная система запуска без лишних кнопок, рычажков и праймеров.... Что еще сказать....",пила заслуживает оценки – отлично! ," мощная, легко справляется с трудоемкой работой. ","можно использовать круглогодично, легкая, мощная, надежная.","надежная антивибрационная система, качественная пила во всем. ","Производитель не обманул, у МС-250 мощности хватает для любых работ.",мощь!!!!!! после 180 которой уже 6 лет эта пила сама пилит! никакого усилия сама вгрызается в древесину и мощи хватает ее уделывать!,"удобная, мощная и работоспособная. "," надежный агрегат, проверено временем. ",Отличная пила.,пила огонь! ,"Легкая, небольшая,",Походу неубиваемая,"мощная, удобная в эксплуатации, надежная.","бензопила походит для таких задач, как строительство из дерева.","мощная, производительная, пригодная для работы в любое время года. ","Ну что могут сказать, с МС-250 отработал уже 2 сезона, причем нагрузку давал капитальную. Отказов не было, тормоз срабатывает ровно тогда, когда нужно. Расход топлива для такой мощности оптимальный, да и обороты держит на ура.
","мощная, быстро заводится, легкая в вправлении.",(0)," В целом, модель MS 250  удобная и производительная. ","Очень мощная техника, при этом легкая и практичная. Взял MS-250 скорее на вырост, так как есть планы по дому и даче. Все что нужно на участке спилил за первые пару дней, работа в удовольствие. Видел отзывы про проблемы  с запуском, но у меня вроде все ок.",Пилит. Причем делает это классно!,"И пилит, и пилит, и пилит! МС-250 у меня уже почти 3 года, на сервис только один раз обращался, да и то для профилактики скорее. Цену оправдывает на 100%, мне была нужна именно мощность. От Штиля брал еще косу, качество всей технике на уровне!", пила полностью устраивает.,"На удивление очень тихая пила, без особых вибраций, очень рад покупкой. Пилка популярная, поэтому никаких проблем в выборе расходников, самое главное правильно хранить жидкости и правильно пользоваться пилой, ухаживать за ней, про что мне любезно сообщили продавцы магазина Centertool на плеханке, спасибо кстати им огромное. Кстати этого магазина нет тут в списке, а жаль, цена самая низкая, пила оригинальная, с номером, гарантией, не то что на рынке и во всяких подозрительных магазинах, ну вы понимаете о чём я, все знают, что такой оригинал и что такое потделка.",все нравится,"Легкая, удобная, достаточно мощная. Сборка - Германия. Адекватный карбюратор, стандартные настройки которого указаны в инструкции. Экономичная система смазки ematic, на бак бензиновой смеси (0.47 л) расходует примерно 0.15 л масла. Удобный доступ к воздушному фильтру, планке зима-лето и свече. Внутреннее сцепление, которое существенно упрощает чистку картера и замену цепи. Зубчатый упор входит в стандартную комплектацию. Отлично заводится.",все описал в комменте.,"Качество сборки, удобство работы, вес.",для домашних целей отличная пила ,"мощная, надежная и безотказная в работе, хорошая АС.",приемлемое качество за умеренную цену,"Сегодня стал обладателем данной пилы сразу решил обкатать, не напрягая пилу с передышками перепилил около 3 кубов березняка. Что могу сказать пила новая компрессия зверская, заводится с одного двух рывков. хорошо реагирует на газ, при распилке дерева большего диаметра обороты не падают бензина хватает на долго. Легко найти расходники, (цепи, полотна, звездочки)","Новая пила июнь 2018 мс 250 в первый день незавести , завел только на второй день , задымила потом стало подтекать масло под глушителем, на третий день тоже самое вроде работает хорошо но масло течет постоянно , немогу понять толи с целиндра толи между цилиндром и глушителем !!!
Вобшем повезу в магазин обратно. и Это за 17.500 руб","Купил в 2012 году поработал на рубке срубов и через год она накрылась сальники потрескались со стороны сцепления подшибник выносился перебрал её и толку ни какого не пилит а мучает. корбюратор не отрегулировать где сасёт воздух не понять. запчасти по цене того не стоят лучше взять новую. И всё это наверное гаражная сборка КИТАЙСКАЯ. Первые Stihlи работали по 5- 6 лет и не чего не ломалось. меняли только цепи, шины и свечи.","Купил в 2012 году поработал на рубке срубов и через год она накрылась сальники потрескались со стороны сцепления подшибник выносился перебрал её и толку ни какого не пилит а мучает. корбюратор не отрегулировать где сасёт воздух не понять. запчасти по цене того не стоят лучше взять новую. И всё это наверное гаражная сборка ""КИТАЙСКАЯ"". Первые Stihlи работали по 5- 6 лет и не чего не ломалось. меняли только цепи, шины и свечи.","купил,обкатал,поработал один день отдал в ремонт,поломка подшипника выход из строя поршневой.Ремонт поршневой группы по гарантии.Жду вторую неделю,а купил чтобы работать.Работаю понтонёром про который сказали что он покойник.Штиль дерьмо так как толку от него даже меньше чем от покойника партнёра.Предлагаю покупать три партнёра в место одного штиль 250.","купил,обкатал,поработал один день отдал в ремонт,поломка подшипника выход из строя поршневой.Ремонт поршневой группы по гарантии.Жду вторую неделю,а купил чтобы работать.Работаю понтонёром про который сказали что он покойник.Штиль дерьмо так как толку от него даже меньше чем от покойника партнёра.Предлагаю покупать три партнёра в место одного штиль 250.","купил,обкатал,поработал один день отдал в ремонт,поломка подшипника выход из строя поршневой.Ремонт поршневой группы по гарантии.Жду вторую неделю,а купил чтобы работать.Работаю понтонёром про который сказали что он покойник.Штиль дерьмо так как толку от него даже меньше чем от покойника партнёра.Предлагаю покупать три партнёра в место одного штиль 250.","У меня этой пилой работала бригада из 15 человек (строим деревянные дома из бруса), покупал по совету своих знакомы,  в общем пила не плохая, но хватает пилы ровно на один год. Сейчас перешли со Штиля 250 на Хускварну 450 Е. По сравнению со Штилём Небо и Земля, Хускварной работать довольно  удобней и быстрей, потери мощности при нагрузке почти ни какой, у Штиля она сильно ощущалась. Плюс экономия топлива почти в два раза и дымит меньше. Система лёгкого запуска  очень удобна.Пила Штиль 250 самый идеальный выбор для частного пользования. Для серьёзной работы лучше выбирать Хускварну, в моём случае это Хускварна 450 Е.","Работаем профессионально - производим древесный уголь, пилим большие объёмы древесины. Пила не первая и не единственная. Была Штилька 250 с 2013 года в постоянной работе, с периодическим обслуживанием в сервесе, работала без нареканий. Не умерла своей смертью (от выработки ресурса), а умерла в пожаре бытовки... Если бы не форс мажор то работала бы и по сей день! А две пилы купленные в марте и апреле 2017г. не проработав и по пол года поехали в капитальный ремонт!!! Причём продованы отказываются делать его по гарантии! Причина у обеих одна и та же - заклинивание подшипников коленвала, следовательно их проворот, разбивание посадочного места приводит к подсосу воздуха. Под замену сальники и крышка поддона картера. 
С продованами за гарантию буду биться не на жизнь а на смерть! Пилу (с таким качеством) могу посоветовать лишь для ""дачно-домашнего"" использования с переплатой за бренд..."
Вячеслав Лунев,Колыванов Александр,ORLOV JURI,Константин Шевцов,Ярослав Вавилов,Ростик Ростислав,Валентин Живилов,Гость,Анатолий Харлаш,Роман Борщев,Миша Соломенко,Гость,Дроздов Саня,Гость,Гал Александр,Коростылев Александр,Мойса Александр,Баринов Олег,Андренко Антон,ORLOV JURI,Валера Снегирев,Иванова Ирина,r. praktik,Женя Косточкин,Ярослав  Кривошеев,Артем Новиков,Виталий Лабудин,Леонид Голубь,Linner Nix,Денис Лобанов,Jordan  Hahn,Буин Алексей,Максим Пенкин,b-axel,Шаронов Дмитрий,Миша Курников,Олег Мосейчук,Богдан Руднев,Руслан Олешкин,Егор Знаменский,Калинин Андрей,Евгений Царев,Василий Гончар,Денис Брянцев,Вадим Карасев,Вячеслав Урицкий,Гость,Гость,Игнатов Андрей,Сергей Новоселов,Кочевряжников Саша,Леонид  Титов,Ростик Панченко,Тимур Саилян,Гость,владимир,данные скрыты,Иванова Ирина,данные скрыты,kalini.andrej2012,Калинин Андрей,данные скрыты,Андренко Антон
2019-05-29,2019-05-26,2019-05-24,2019-04-30,2019-04-27,2019-04-22,2019-04-06,2019-04-04,2019-04-01,2019-03-10,2019-03-08,2019-03-05,2019-03-02,2019-02-25,2019-02-23,2019-02-13,2019-02-10,2019-02-07,2019-02-01,2018-11-26,2018-11-19,2018-11-15,2018-11-11,2018-11-01,2018-10-28,2018-10-24,2018-10-13,2018-10-11,2018-10-08,2018-09-22,2018-09-16,2018-09-14,2018-09-14,2018-09-02,2018-08-31,2018-08-28,2018-08-16,2018-07-23,2018-07-03,2018-07-01,2018-06-24,2018-06-19,2018-06-13,2018-05-12,2018-05-09,2018-04-16,2018-04-14,2018-04-08,2018-02-25,2018-02-09,2018-02-04,2018-01-29,2018-01-12,2018-01-11,2018-01-06,,,,,,,,
